{
  "mode": "historical-sample",
  "buildDate": "2026-10-07",
  "sourceSnapshot": "2019-05-14",
  "complete": false,
  "rows": [
    {
      "id": "nobel-23",
      "name": "Max Karl Ernst Ludwig Planck",
      "birthDate": "1858-04-23",
      "recordedDeathDate": "1947-10-04",
      "status": null,
      "sitelinks": null,
      "portrait": null,
      "fact": null,
      "factStatus": "unverified"
    },
    {
      "id": "nobel-26",
      "name": "Albert Einstein",
      "birthDate": "1879-03-14",
      "recordedDeathDate": "1955-04-18",
      "status": null,
      "sitelinks": null,
      "portrait": null,
      "fact": null,
      "factStatus": "unverified"
    },
    {
      "id": "nobel-27",
      "name": "Niels Henrik David Bohr",
      "birthDate": "1885-10-07",
      "recordedDeathDate": "1962-11-18",
      "status": null,
      "sitelinks": null,
      "portrait": null,
      "fact": null,
      "factStatus": "unverified"
    },
    {
      "id": "nobel-339",
      "name": "Sir Alexander Fleming",
      "birthDate": "1881-08-06",
      "recordedDeathDate": "1955-03-11",
      "status": null,
      "sitelinks": null,
      "portrait": null,
      "fact": null,
      "factStatus": "unverified"
    },
    {
      "id": "nobel-373",
      "name": "James Dewey Watson",
      "birthDate": "1928-04-06",
      "recordedDeathDate": null,
      "status": null,
      "sitelinks": null,
      "portrait": null,
      "fact": null,
      "factStatus": "unverified"
    },
    {
      "id": "nobel-38",
      "name": "Werner Karl Heisenberg",
      "birthDate": "1901-12-05",
      "recordedDeathDate": "1976-02-01",
      "status": null,
      "sitelinks": null,
      "portrait": null,
      "fact": null,
      "factStatus": "unverified"
    },
    {
      "id": "nobel-39",
      "name": "Erwin Schrödinger",
      "birthDate": "1887-08-12",
      "recordedDeathDate": "1961-01-04",
      "status": null,
      "sitelinks": null,
      "portrait": null,
      "fact": null,
      "factStatus": "unverified"
    },
    {
      "id": "nobel-40",
      "name": "Paul Adrien Maurice Dirac",
      "birthDate": "1902-08-08",
      "recordedDeathDate": "1984-10-20",
      "status": null,
      "sitelinks": null,
      "portrait": null,
      "fact": null,
      "factStatus": "unverified"
    },
    {
      "id": "nobel-470",
      "name": "Theodore Roosevelt",
      "birthDate": "1858-10-27",
      "recordedDeathDate": "1919-01-06",
      "status": null,
      "sitelinks": null,
      "portrait": null,
      "fact": null,
      "factStatus": "unverified"
    },
    {
      "id": "nobel-483",
      "name": "Thomas Woodrow Wilson",
      "birthDate": "1856-12-28",
      "recordedDeathDate": "1924-02-03",
      "status": null,
      "sitelinks": null,
      "portrait": null,
      "fact": null,
      "factStatus": "unverified"
    },
    {
      "id": "nobel-5",
      "name": "Pierre Curie",
      "birthDate": "1859-05-15",
      "recordedDeathDate": "1906-04-19",
      "status": null,
      "sitelinks": null,
      "portrait": null,
      "fact": null,
      "factStatus": "unverified"
    },
    {
      "id": "nobel-524",
      "name": "Martin Luther King Jr.",
      "birthDate": "1929-01-15",
      "recordedDeathDate": "1968-04-04",
      "status": null,
      "sitelinks": null,
      "portrait": null,
      "fact": null,
      "factStatus": "unverified"
    },
    {
      "id": "nobel-552",
      "name": "Mikhail Sergeyevich Gorbachev",
      "birthDate": "1931-03-02",
      "recordedDeathDate": null,
      "status": null,
      "sitelinks": null,
      "portrait": null,
      "fact": null,
      "factStatus": "unverified"
    },
    {
      "id": "nobel-555",
      "name": "Nelson Mandela",
      "birthDate": "1918-07-18",
      "recordedDeathDate": "2013-12-05",
      "status": null,
      "sitelinks": null,
      "portrait": null,
      "fact": null,
      "factStatus": "unverified"
    },
    {
      "id": "nobel-577",
      "name": "Rudyard Kipling",
      "birthDate": "1865-12-30",
      "recordedDeathDate": "1936-01-18",
      "status": null,
      "sitelinks": null,
      "portrait": null,
      "fact": null,
      "factStatus": "unverified"
    },
    {
      "id": "nobel-583",
      "name": "Rabindranath Tagore",
      "birthDate": "1861-05-07",
      "recordedDeathDate": "1941-08-07",
      "status": null,
      "sitelinks": null,
      "portrait": null,
      "fact": null,
      "factStatus": "unverified"
    },
    {
      "id": "nobel-6",
      "name": "Marie Curie, née Sklodowska",
      "birthDate": "1867-11-07",
      "recordedDeathDate": "1934-07-04",
      "status": null,
      "sitelinks": null,
      "portrait": null,
      "fact": null,
      "factStatus": "unverified"
    },
    {
      "id": "nobel-617",
      "name": "Hermann Hesse",
      "birthDate": "1877-07-02",
      "recordedDeathDate": "1962-08-09",
      "status": null,
      "sitelinks": null,
      "portrait": null,
      "fact": null,
      "factStatus": "unverified"
    },
    {
      "id": "nobel-620",
      "name": "William Faulkner",
      "birthDate": "1897-09-25",
      "recordedDeathDate": "1962-07-06",
      "status": null,
      "sitelinks": null,
      "portrait": null,
      "fact": null,
      "factStatus": "unverified"
    },
    {
      "id": "nobel-621",
      "name": "Earl (Bertrand Arthur William) Russell",
      "birthDate": "1872-05-18",
      "recordedDeathDate": "1970-02-02",
      "status": null,
      "sitelinks": null,
      "portrait": null,
      "fact": null,
      "factStatus": "unverified"
    },
    {
      "id": "nobel-624",
      "name": "Sir Winston Leonard Spencer Churchill",
      "birthDate": "1874-11-30",
      "recordedDeathDate": "1965-01-24",
      "status": null,
      "sitelinks": null,
      "portrait": null,
      "fact": null,
      "factStatus": "unverified"
    },
    {
      "id": "nobel-625",
      "name": "Ernest Miller Hemingway",
      "birthDate": "1899-07-21",
      "recordedDeathDate": "1961-07-02",
      "status": null,
      "sitelinks": null,
      "portrait": null,
      "fact": null,
      "factStatus": "unverified"
    },
    {
      "id": "nobel-628",
      "name": "Albert Camus",
      "birthDate": "1913-11-07",
      "recordedDeathDate": "1960-01-04",
      "status": null,
      "sitelinks": null,
      "portrait": null,
      "fact": null,
      "factStatus": "unverified"
    },
    {
      "id": "nobel-634",
      "name": "John Steinbeck",
      "birthDate": "1902-02-27",
      "recordedDeathDate": "1968-12-20",
      "status": null,
      "sitelinks": null,
      "portrait": null,
      "fact": null,
      "factStatus": "unverified"
    },
    {
      "id": "nobel-637",
      "name": "Jean-Paul Sartre",
      "birthDate": "1905-06-21",
      "recordedDeathDate": "1980-04-15",
      "status": null,
      "sitelinks": null,
      "portrait": null,
      "fact": null,
      "factStatus": "unverified"
    },
    {
      "id": "nobel-670",
      "name": "Toni Morrison",
      "birthDate": "1931-02-18",
      "recordedDeathDate": null,
      "status": null,
      "sitelinks": null,
      "portrait": null,
      "fact": null,
      "factStatus": "unverified"
    },
    {
      "id": "nobel-845",
      "name": "Barack H. Obama",
      "birthDate": "1961-08-04",
      "recordedDeathDate": null,
      "status": null,
      "sitelinks": null,
      "portrait": null,
      "fact": null,
      "factStatus": "unverified"
    },
    {
      "id": "nobel-86",
      "name": "Richard P. Feynman",
      "birthDate": "1918-05-11",
      "recordedDeathDate": "1988-02-15",
      "status": null,
      "sitelinks": null,
      "portrait": null,
      "fact": null,
      "factStatus": "unverified"
    },
    {
      "id": "nobel-914",
      "name": "Malala Yousafzai",
      "birthDate": "1997-07-12",
      "recordedDeathDate": null,
      "status": null,
      "sitelinks": null,
      "portrait": null,
      "fact": null,
      "factStatus": "unverified"
    },
    {
      "id": "nobel-937",
      "name": "Bob Dylan",
      "birthDate": "1941-05-24",
      "recordedDeathDate": null,
      "status": null,
      "sitelinks": null,
      "portrait": null,
      "fact": null,
      "factStatus": "unverified"
    }
  ]
}
